{
  "name": "Extended Financial PII",
  "version": "1.0.0",
  "description": "Extended financial PII detection patterns including international formats",
  "author": "Community Contributor",
  "tags": ["financial", "international", "banking"],
  "rules": [
    {
      "id": "iban_international",
      "name": "IBAN Number",
      "description": "Detects International Bank Account Numbers (IBAN)",
      "pattern": "\\b[A-Z]{2}[0-9]{2}[A-Z0-9]{4}[0-9]{7}([A-Z0-9]?){0,16}\\b",
      "flags": "g",
      "replacement": "[REDACTED_IBAN]",
      "confidence": 0.90,
      "category": "financial",
      "severity": "critical",
      "enabled": true,
      "testCases": [
        {
          "input": "Bank account: GB82WEST12345698765432",
          "expected": "Bank account: [REDACTED_IBAN]",
          "shouldMatch": true
        },
        {
          "input": "Reference code ABC123DEF456",
          "expected": "Reference code ABC123DEF456",
          "shouldMatch": false
        }
      ]
    },
    {
      "id": "swift_bic",
      "name": "SWIFT/BIC Code",
      "description": "Detects SWIFT Bank Identifier Codes",
      "pattern": "\\b[A-Z]{4}[A-Z]{2}[A-Z0-9]{2}([A-Z0-9]{3})?\\b",
      "flags": "g",
      "replacement": "[REDACTED_SWIFT]",
      "confidence": 0.85,
      "category": "financial",
      "severity": "medium",
      "enabled": true,
      "testCases": [
        {
          "input": "SWIFT code: DEUTDEFF500",
          "expected": "SWIFT code: [REDACTED_SWIFT]",
          "shouldMatch": true
        },
        {
          "input": "Code ABC123 is invalid",
          "expected": "Code ABC123 is invalid",
          "shouldMatch": false
        }
      ]
    },
    {
      "id": "routing_number_us",
      "name": "US Routing Number",
      "description": "Detects US bank routing numbers (ABA numbers)",
      "pattern": "\\b[0-9]{9}\\b",
      "flags": "g",
      "replacement": "[REDACTED_ROUTING]",
      "confidence": 0.70,
      "category": "financial",
      "severity": "high",
      "enabled": false,
      "testCases": [
        {
          "input": "Routing number: 021000021",
          "expected": "Routing number: [REDACTED_ROUTING]",
          "shouldMatch": true
        },
        {
          "input": "Year 2024 was good",
          "expected": "Year 2024 was good",
          "shouldMatch": false
        }
      ]
    },
    {
      "id": "crypto_wallet_bitcoin",
      "name": "Bitcoin Wallet Address",
      "description": "Detects Bitcoin wallet addresses",
      "pattern": "\\b[13][a-km-zA-HJ-NP-Z1-9]{25,34}\\b",
      "flags": "g",
      "replacement": "[REDACTED_BITCOIN_WALLET]",
      "confidence": 0.85,
      "category": "financial",
      "severity": "medium",
      "enabled": true,
      "testCases": [
        {
          "input": "Send BTC to 1A1zP1eP5QGefi2DMPTfTL5SLmv7DivfNa",
          "expected": "Send BTC to [REDACTED_BITCOIN_WALLET]",
          "shouldMatch": true
        },
        {
          "input": "Random string 1234567890",
          "expected": "Random string 1234567890",
          "shouldMatch": false
        }
      ]
    },
    {
      "id": "crypto_wallet_ethereum",
      "name": "Ethereum Wallet Address",
      "description": "Detects Ethereum wallet addresses",
      "pattern": "\\b0x[a-fA-F0-9]{40}\\b",
      "flags": "g",
      "replacement": "[REDACTED_ETHEREUM_WALLET]",
      "confidence": 0.95,
      "category": "financial",
      "severity": "medium",
      "enabled": true,
      "testCases": [
        {
          "input": "ETH address: 0x742d35Cc6634C0532925a3b8D4000cF5e5a4a7d8",
          "expected": "ETH address: [REDACTED_ETHEREUM_WALLET]",
          "shouldMatch": true
        },
        {
          "input": "Hex value 0x123ABC",
          "expected": "Hex value 0x123ABC",
          "shouldMatch": false
        }
      ]
    }
  ]
}